,url,text
14,https://www.rbc.ru/politics/28/03/2022/624179f69a7947dc09f19641,"Продвижения в вопросе о личной встрече президентов России и Украины Владимира Путина и Владимира Зеленского нет, заявил пресс-секретарь главы государства Дмитрий Песков. «Нет», — ответил он на соответствующий вопрос. Президент Украины Владимир Зеленский неоднократно выражал готовность встретиться с Путиным. В свою очередь, глава российской делегации на переговорах с Киевом Владимир Мединский говорил, что вопрос о встрече на высшем уровне подлежит обсуждению только после того, как стороны договорятся о мирном урегулировании. В Кремле идею о встрече на высшем уровне называли «концептуально возможной». Песков, говоря о возможной встрече двух президентов, заявил, что украинской стороне перед этим необходимо выполнить «домашнюю работу» — то есть согласовать результаты переговоров на уровне делегаций. Иначе, утверждал пресс-секретарь, главам государств «нечего будет фиксировать». Организовать встречу Путина и Зеленского на своей территории предлагали президенты Азербайджана и Турции Ильхам Алиев и Реджеп Тайип Эрдоган, причем последний делал это не один раз. В свою очередь, глава турецкого МИД Мевлют Чавушоглу заявил, что Путин говорил Эрдогану, что не возражает против встречи с Зеленским. С начала военной спецоперации России на Украине делегации обеих стран трижды встречались на территории Белоруссии, затем переговоры продолжились в видеоформате. Украинская сторона добивается вывода российских войск с территории страны и гарантий безопасности, а Россия — юридически оформленного отказа Украины от вступления в военные блоки и размещения вооружений на своей территории. Также Москва стремится добиться признания Киевом ДНР, ЛНР и вхождения Крыма в состав России. Очередной раунд переговоров, по словам министра иностранных дел Сергея Лаврова, должен состояться в очном формате в Стамбуле «сегодня-завтра». Песков при этом говорил, что в понедельник делегации только прибудут в Турцию, тогда как переговоры, вероятно, начнутся 29 марта."
15,https://www.rbc.ru/rbcfreenews/6240c7529a7947a50b4beebc,"Министр иностранных дел Турции Мевлют Чавушоглу провел телефонный разговор с российским коллегой Сергеем Лавровым, передает турецкий телеканал TRT World. Главы турецкого и российского МИД обсуждали «последние события на Украине». Какие именно темы они затронули, телеканал не уточнил. Турция выразила надежду на прекращение огня после переговоров в Стамбуле Политика Ранее военную операцию на Украине также обсудили российский и турецкий президенты Владимир Путин и Реджеп Тайип Эрдоган. «В ходе беседы президент Эрдоган подчеркнул необходимость прекращения огня, а также скорейшего [достижения] мира между Россией и Украиной, улучшения гуманитарной ситуации в регионе», — заявили в канцелярии турецкого лидера. В заявлении администрации Эрдогана также подчеркивалось, что Турция готова «всеми возможными способами» способствовать процессу урегулирования. Кроме того, Путин и Эрдоган договорились о проведении следующей встречи делегаций России и Украины в Стамбуле. Член украинской делегации Давид Арахамия сообщил, что очные переговоры пройдут с 28 по 30 марта. Глава делегации России Владимир Мединский анонсировал очную встречу 29–30 марта. «Мы надеемся, что встречи приведут к прекращению огня на длительное время и создадут возможность для мира», — заявил позже Чавушоглу."
16,https://www.rbc.ru/politics/27/03/2022/6240a5139a79479f63244bf9,"Владимир Путин и Реджеп Эрдоган договорились о проведении следующей встречи делегаций России и Украины в Стамбуле, сообщила канцелярия турецкого президента. Главы государств провели телефонный разговор, в ходе которого обсудили российско-украинский конфликт. «В ходе беседы президент Эрдоган подчеркнул необходимость прекращения огня, а также скорейшего [достижения] мира между Россией и Украиной, улучшения гуманитарной ситуации в регионе», — заявили в администрации Эрдогана. В заявлении подчеркивается, что Турция готова «всеми возможными способами» способствовать процессу урегулирования. Ранее в воскресенье член украинской делегации Давид Арахамия сообщил, что очные переговоры с российской стороной пройдут с 28 по 30 марта в Турции. Глава делегации России Владимир Мединский анонсировал очную встречу 29–30 марта, не указав место ее проведения. Мединский анонсировал очный раунд переговоров с Украиной Политика 24 февраля на Украине началась российская военная операция с целью «демилитаризации и денацификации». Украина ввела военное положение и разорвала дипломатические отношения с Россией. С начала военных действий стороны провели несколько раундов переговоров. Три из них были очными и прошли в Белоруссии, затем обсуждение продолжилось в видеоформате. В турецкой администрации сообщали, что делегации обсуждают шесть основных вопросов. Это денацификация Украины, демилитаризация и взаимные гарантии безопасности, отказ Киева от членства в НАТО, отказ от ограничений в отношении русского языка, статус республик Донбасса и принадлежность Крыма. Основные требования украинской стороны — вывод российских войск и гарантии безопасности. Мединский 25 марта заявил, что позиции сторон сближаются по второстепенным вопросам, но по главным темам делегации «топчутся на месте». Об этом же говорил и глава украинского МИДа Дмитрий Кулеба. Анкара не раз заявляла о готовности помочь в организации мирных переговоров. Эрдоган неоднократно предлагал провести встречу президентов России и Украины в Турции."
17,https://www.rbc.ru/rbcfreenews/623f151c9a79474537a69575,"В Босфорском проливе проблем с судоходством нет. Об этом заявил министр обороны Турции Хулуси Акар, передает газета Start. Ранее в проливе было обнаружено устройство, похожее на мину. «Сейчас для судоходства никаких проблем нет. Соответствующие части и команды наших ВМС продолжают работу», — сказал Акар журналистам. Video Турция перекрыла Босфор из-за «похожего на мину» предмета Общество Мина в Босфоре была обнаружена 26 марта в районе якорной стоянки Сарыер-Тюркели. После обнаружения устройства движение судов было приостановлено. Минобороны начало работы по нейтрализации взрывного устройства. Ранее в середине марта ФСБ России сообщила, что некоторые мины, установленные военными Украины на подходах к черноморским портам, из-за обрыва тросов под воздействием течения начали дрейфовать в Черное море. «Мины под воздействием ветра и течения свободно перемещаются (дрейфуют) в западной части Черного моря. Обрыв минрепов говорит о неудовлетворительном техническом состоянии мин», — отмечали в ФСБ и предупреждали, что течение может унести мины в Босфор и Средиземное море."
18,https://www.rbc.ru/politics/31/03/2022/6245617c9a7947bc739707c6,"Россия и Украина сейчас не обсуждают часть вопросов в отношениях между странами, заявил глава МИД Турции Мевлют Чавушоглу в интервью турецкому порталу A Haber. Чавушоглу считает, что наибольшего прогресса сторонам удалось достичь на встрече делегаций двух стран в Стамбуле, после которой Киев заявил, что Украина готова к нейтральному статусу, но хочет получить твердые гарантии безопасности. Однако, по его словам, до завершения переговоров далеко. «По некоторым вопросам достигнуто общее понимание консенсуса. Сейчас мы видим, что некоторые вопросы не обсуждаются», — сказал Чавушоглу. По его словам, стороны не могут договориться о гарантиях безопасности Украины, а также по двум «самым сложным» вопросам — статусе Крыма и Донбасса. Это вопросы, которые, по словам Чавушоглу, следует решать на уровне первых лиц обеих стран. Также Чавушоглу напомнил, что Киев намеревается провести референдум по поводу соглашения с Россией. «Если украинский народ скажет нет на референдуме, все пойдет прахом», — отмечает Чавушоглу. По его словам, если понимание по этим пунктам не будет достигнуто за один-два месяца, то конфликт будет продолжаться. Переговоры двух стран состоялись в Стамбуле 29 марта, делегаты встречались во дворце Долмабахче. Встреча, на которую изначально закладывали два дня, завершилась за один. К чему пришли Москва и Киев на переговорах во дворце османских султанов Политика После нее Россия объявила о сокращении военной активности на киевском и черниговском направлениях, а также о том, что получила письменные предложения украинской стороны, которые предполагают отказ от стремления вернуть Крым и Донбасс военным путем, нейтральный статус страны с международно-правовыми гарантиями и беспрепятственное вступление в Европейский союз. Киев по итогам переговоров сообщил, что предлагает обсуждать вопросы статуса Крыма и Донбасса отдельно, зафиксировав разные позиции по вопросу принадлежности территорий. Также Украина предлагает оговорить в соглашении, что в течение 15 лет страны не будут использовать вооруженные силы для решения крымского вопроса. Также Киев сообщил, что согласится на внеблоковый и безъядерный статус страны, если гарантами безопасности станут Великобритания, Китай, США, Турция, Франция, Канада, Италия, Польша и Израиль. Решение по договору о гарантиях должно быть принято на всеукраинском референдуме. Комментируя итоги переговоров, пресс-секретарь президента России Дмитрий Песков заявил, что передача предложений Киева Москве в письменном виде — это позитивный сдвиг, но о чем-то «многообещающем» договориться сторонам не удалось. Глава МИД России Сергей Лавров говорил 30 марта, что на встрече был достигнут существенный прогресс» в том, что касается обеспечения неядерного, внеблокового статуса Украины и гарантий ее безопасности «вне рамок Североатлантического альянса», а также заявил, что «украинские коллеги» понимают, что «вопросы Крыма и Донбасса окончательно решены». Минобороны России 30 марта объявило, что Вооруженные силы выполнили все основные задачи на киевском и черниговском направлениях в рамках спецоперации на Украине. Как пояснил официальный представитель ведомства Игорь Конашенков, военное командование планировало сковать украинские силы на поле боя и нанести такое поражение, которое не позволило бы Киеву использовать военные силы на донбасском направлении — его Вооруженные силы РФ определили для себя как главное. Эта задача была выполнена, и теперь на этих направлениях происходит плановая перегруппировка войск. Ранее российский Генштаб говорил, что штурм украинских городов, блокированных российскими военными: Киева, Харькова, Чернигова, Сум и Николаева — не приоритетная задача для Москвы. Главной задачей Минобороны называло «полное освобождение Донбасса»."
19,https://www.rbc.ru/politics/29/03/2022/6242c1c89a79474d6dc1aed8,"Переговоры делегаций России и Украины, которые начались утром 29 марта в Турции, не приведут ни к какому результату, считает глава Чеченской республики Рамзан Кадыров. Об этом он рассказал в Telegram. «Думаю о переговорах, которые проходят в Турции. И думаю, это мое мнение, убеждение, что от этих переговоров никакого толка не будет. Я считаю, что нужно закончить полностью начатое, уничтожить бандеровцев, нациков и шайтанов. И только тогда нужно принимать решение, что делать дальше. <...> Это мое мнение», — сказал Кадыров. Российский президент Владимир Путин 24 февраля объявил о начале специальной военной операции на Украине, целью которой являются «денацификация и демилитаризация» страны. Два дня спустя Кадыров подтвердил, что в спецоперации участвуют чеченские подразделения. В середине марта Кадыров приезжал в Мариуполь. Министр по национальной политике, внешним связям, печати и информации Чечни Ахмед Дудаев говорил, что Кадыров приезжал в город, чтобы «поднять боевой дух ребят» и доработать стратегию. 28 марта глава Чеченской республики заявил, что военные «дом за домом» прочесывают многоэтажки Мариуполя, и до «полного освобождения» города «осталось совсем недолго». Эрдоган обратился к делегациям перед переговорами Москвы и Киева Политика В Стамбуле утром 29 марта стартовал очередной раунд переговоров между Украиной и Россией по мирному урегулированию конфликта. Москва настаивает на заключении комплексного договора, который бы предусматривал «жизненно важные» для нее позиции, в том числе — «демилитаризацию, денацификацию» Украины, признание российского суверенитета над Крымом и независимости Луганской и Донецкой республик. Киев требует вывода российских войск и предоставления гарантий безопасности. Президент Украины Владимир Зеленский ранее говорил, что готов искать компромисс с Россией по вопросам Крыма и Донбасса, а также о том, что проведет всеукраинский референдум по достигнутым с Россией договоренностям. Сами переговоры он называл «иногда скандальными» и сложными, тем не менее, по его словам, они «продвигаются вперед». С конца февраля представители России и Украины провели уже несколько раундов переговоров. Сначала переговоры шли в очном формате — делегации трижды встречались в Белоруссии, затем перешли в видеоформат. Глава российской делегации Владимир Мединский говорил в середине марта, что позиции России и Украины «максимально сблизились» в обсуждении нейтрального статуса Украины и ее невступления в НАТО, однако позднее он заявил, что позиции сближаются по второстепенным вопросам, а в том, что касается ключевых — «топчутся на месте». Член украинской делегации и советник главы офиса президента страны Михаил Подоляк говорил, что обсуждение нейтрального статуса Украины может быть только с «абсолютными гарантиями безопасности», так как Киев не хочет «зависеть от бюрократических процедур, которые позволяют или не позволяют закрывать небо от тех же крылатых ракет», и ей нужны «жесткие гарантии, что небо будет обязательно закрыто». Сенатор Андрей Клишас, комментируя начало переговоров в Стамбуле 29 марта, написал в Telegram, что контакты делегаций нужны, «но нельзя забывать и про то, что стало с минскими соглашениями»."
