,url,text
4,https://www.rbc.ru/politics/27/03/2022/62407f159a79479583947115,"Переговоры российской и украинской делегаций пройдут 29–30 марта в очном формате. Об этом в своем Telegram-канале заявил глава российской делегации, помощник президента Владимир Мединский. «Сегодня прошел очередной раунд переговоров с Украиной по ВКС. В результате принято решение встретиться в очном формате 29–30 марта», — написал он. В свою очередь член украинской делегации на переговорах Давид Арахамия уточнил, что переговоры пройдут с 28 по 30 марта в Турции. Медведев назвал цели России и Украины на переговорах Политика 24 февраля президент Владимир Путин объявил о начале военной операции на Украине, целью которой он назвал «демилитаризацию и денацификацию» соседней страны. Среди других требований — признание Киевом Крыма российским, а ДНР и ЛНР — независимыми государствами. С тех пор стороны провели несколько раундов переговоров в Белоруссии, затем обсуждение продолжилось в видеоформате. 18 марта Мединский заявил, что по вопросу демилитаризации Украины стороны находятся «где-то на полпути», подчеркнув, что не уполномочен раскрывать детали. «Что касается денацификации — ситуация достаточно странная, потому что украинские коллеги с другой стороны стола считают, что на Украине нет никаких нацистских образований», — добавил он. В то же время, по словам помощника президента, Москва и Киев «максимально сблизили свои позиции» по вопросам нейтрального статуса и отказа Украины от вступления в НАТО. В Киеве в ответ подчеркнули, что модель нейтралитета может быть лишь украинской и в условиях «юридически выверенных гарантий безопасности». 21 марта президент Украины Владимир Зеленский объявил, что проведет всеукраинский референдум по достигнутым с Россией договоренностям. При этом он охарактеризовал ежедневные переговоры как «очень сложные» и «иногда скандальные». Однако, по его словам, они «продвигаются шаг за шагом». Пресс-секретарь президента России Дмитрий Песков в ответ на предложение Зеленского по проведению референдума заявил, что «в настоящий момент вынесение их [деталей переговоров] на публику может только повредить переговорному процессу, который и так идет гораздо медленнее и менее содержательно, чем нам хотелось бы»."
5,https://www.rbc.ru/politics/29/03/2022/6242ff049a794771598c843a,"Киев предложил включить в соглашение с Россией формулировку о том, что Москва не будет против вступления Украины в Евросоюз. Об этом говорится в письменных предложениях, которые зачитал в эфире «Первого канала» помощник президента и глава российской делегации Владимир Мединский. «Украина отказывается от вступления в военные союзы, от размещения иностранных военных баз, контингентов, проведения военных учений на территории Украины без согласия государств-гарантов, включая Российскую Федерацию. Со своей стороны Российская Федерация не возражает против стремления Украины вступить в Европейский союз», — зачитал Мединский предложение Украины. По его словам, это и другие положения «ни в коем случае не положения договора, а предложения, которые мы считаем конструктивным шагом к поиску компромисса», подчеркнул Мединский. В заголовок и текст новости были внесены изменения после проверки сообщений информационных агентств. Украина подала заявку на вступление в Евросоюз на фоне военной спецоперации России 28 февраля. Президент Владимир Зеленский попросил принять страну в ЕС немедленно, по «новой специальной процедуре». Скорое вступление Украины в ЕС поддержали восемь стран-участниц — Болгария, Чехия, Эстония, Латвия, Литва, Польша, Словакия и Словения. Вопрос возможного членства Украины лидеры стран ЕС обсудили на неформальном саммите в Версале 10 марта. В совместном заявлении по итогам встречи говорилось, что заключение по украинской заявке даст Еврокомиссия, а до того времени планируется укреплять партнерские отношения с Киевом. При этом ряд представителей стран ЕС отметили, что оценка ЕК может занять продолжительное время. В частности, премьер-министр Нидерландов Марк Рютте заявил, что «для вступления в ЕС нет ускоренной процедуры», а премьер-министр Хорватии Андрей Пленкович отметил, что «никто не вошел в Европейский союз за одну ночь». Тем не менее в Евросоюзе уже начали рассматривать заявку Украины. Как сообщил Reuters, в ЕС нет единого мнения о возможном ее членстве. Сторонники отказа Киеву в статусе кандидата опасаются, что принятие Украины в ЕС приведет к проблемам с другими странами, которые также подали заявки, — Молдавией и Грузией, а также с уже официальными кандидатами — Северной Македонией, Черногорией, Албанией и Сербией, пишет агентство. В свою очередь, в Кремле, комментируя вопрос возможного членства Украины в ЕС, отметили, что это вопрос другого разряда, нежели вопрос о возможном принятии страны в НАТО. «ЕС — это не военно-политический блок, то есть в этом плане <...> эта тема лежит в другой плоскости», — сказал пресс-секретарь президента Дмитрий Песков."
6,https://www.rbc.ru/politics/28/03/2022/62419e629a7947f08645ad36,"«Новая газета» приостановила выпуск после того, как получила второе предупреждение от Роскомнадзора, сообщили РБК в редакции издания. «Мы получили еще одно предупреждение Роскомнадзора. После этого мы приостанавливаем выпуск газеты в сетях и на бумаге до окончания «специальной операции на территории Украины», — говорится в сообщении. Ранее Роскомнадзор вынес повторное предупреждение редакции «Новой газеты» за отсутствие маркировки НКО-иноагента в материале. «Почта России» расследует пропажу подписки на «Новую газету» Технологии и медиа Роскомнадзор вынес первое предупреждение «Новой газете» 22 марта. Как заявили тогда в ведомстве, оно также было связано с отсутствием маркировки НКО-иноагента в одном из материалов. Роскомнадзор потребовал незамедлительно отредактировать материал без маркировки и сообщить об этом. У СМИ, которое получает два предупреждения Роскомнадзора в год, могут отозвать лицензию. В день, когда «Новая газета» получила первое предупреждение, главред издания Дмитрий Муратов сообщил, что намерен продать свою Нобелевскую медаль и передать полученные деньги в фонд помощи украинским беженцам. Он также заявил, что необходимо немедленно предпринять ряд шагов: прекратить огонь, обменять пленных, возвратить тела погибших, дать гуманитарные коридоры и помощь и обеспечить беженцев. 25 марта редакция «Новой газеты» сообщила, что «Почта России» закрыла подписку на сайте. Кроме того, издание получило многочисленные жалобы читателей о том, что компания не доставляет новые выпуски и не выдает газету в отделениях. В частности, в Петербурге в одном из киосков отказались продавать гражданам номер от 16 марта, еще ряд читателей получили вместо выпуска газеты записки от почтальонов о том, что газета запрещена руководством, а тираж признан экстремистским. Позже подписку на «Новую газету» на сайте «Почты России» восстановили, а в компании пообещали расследовать случившееся. «Никаких указаний от руководства компании снять издание с подписки не было и быть не могло — это прямое нарушение нашего договора с изданием», — заявили в «Почте России»."
7,https://www.rbc.ru/politics/30/03/2022/62445a089a79476af604c8a8,"Video Украина впервые выразила свою готовность выполнить ряд важнейших условий, чтобы в будущем построить нормальные отношения с Россией, заявил журналистам помощник президента и глава российской делегации Владимир Мединский. «Вчера украинская сторона впервые зафиксировала, причем в письменном виде, свою готовность к выполнению целого ряда важнейших условий для строительства в будущем нормальных и, надеюсь, добрососедских отношений с Россией», — сказал он. К чему пришли Москва и Киев на переговорах во дворце османских султанов Политика Российская и украинская делегации 29 марта провели очные переговоры в Стамбуле. По их итогам Москва получила от Киева письменные предложения по политическому урегулированию. Как сообщил Мединский, Украина предложила систему гарантий безопасности, включающую нейтральный статус государства. Гарантами этой системы могут стать постоянные члены Совета Безопасности ООН, а также Турция, Германия, Италия, Израиль, Польша и Канада. Эти гарантии безопасности не будут распространяться на Крым и Донбасс. Украина также отказывается от стремления вернуть эти территории военным путем. Помимо этого, страна хотела бы, чтобы Россия не возражала против ее вступления в ЕС. Россия, в свою очередь, пообещала сократить военную активность на двух направлениях — киевском и черниговском, а также заявила о возможности встречи президентов двух стран одновременно с тем, как их министры иностранных дел будут подписывать подготовленный договор. В то же время в Кремле заявили, что хоть передача Киевом письменных предложений и стала позитивным фактом, в остальном пока нет «чего-то сильно многообещающего, каких-то прорывов». Как отметил пресс-секретарь президента Дмитрий Песков, впереди Москву и Киев еще ждет длительная работа."
8,https://www.rbc.ru/rbcfreenews/623f388f9a79474d219ad7f0,"Минсельхоз Турции сообщил, что власти страны решили ввести запрет на рыбную ловлю в ночное время суток в части акватории Черного моря после обнаружения мины в Босфоре. Об этом министерство сообщило на своей странице в Twitter. «Для безопасности жизни и имущества наших рыбаков и нашего народа с сегодняшнего дня до следующего объявления вводится запрет на все виды рыбной ловли с захода до восхода солнца в водах Черного моря между Болгарией и Кефкеном», — говорится в заявлении. Турция заявила об отсутствии проблем с судоходством из-за мины в Босфоре Политика Ранее в Босфорском проливе было обнаружено устройство, похожее на мину. Власти Турции временно приостановили плавание судов в этом районе. Как позже заявил министр обороны страны Хулуси Акар, обнаруженная мина не навредит судоходству в Босфорском проливе. В середине марта ФСБ России сообщила, что некоторые мины, установленные военными Украины на подходах к черноморским портам, из-за обрыва тросов под воздействием течения начали дрейфовать в Черное море. «Мины под воздействием ветра и течения свободно перемещаются (дрейфуют) в западной части Черного моря. Обрыв минрепов говорит о неудовлетворительном техническом состоянии мин», — отмечали в ФСБ и предупреждали, что течение может унести мины в Босфор и Средиземное море."
9,https://www.rbc.ru/politics/26/03/2022/623f02449a79473a7403b051,"Президент США Джо Байден встретился с министрами иностранных дел и обороны Украины Дмитрием Кулебой и Алексеем Резниковым в Польше, сообщает Bloomberg. Ранее Белый дом анонсировал, что Байден приедет на встречу Кулебы и Резникова с американскими коллегами, госсекретарем Энтони Блинкеном и министром обороны Ллойдом Остином, в Варшаве. Байден присоединился к ним приблизительно через час после начала встречи и пробыл там около 40 минут, отмечает Bloomberg. Блинкен и Остин пообещали, что Соединенные Штаты продолжат оказывать гуманитарную и экономическую помощь Украине, сказал пресс-секретарь Госдепартамента Нед Прайс. В Киеве предложили ЕС хранить стратегический запас газа на Украине Политика Кулеба после разговора с Блинкеном и Остином написал в Twitter, что подобные встречи позволяют «искать практические решения как в политической, так и в оборонной сферах», чтобы усилить способность Украины противостоять России. В субботу Байден также встретился с президентом Польши Анджеем Дудой и украинскими беженцами. Ранее американский лидер принял участие в саммитах НАТО, G7 и ЕС. Глава Европейской комиссии Урсула фон дер Ляйен сообщила, что Евросоюз и США договорились о новом энергетическом партнерстве. В частности, речь идет о поставках в этом году как минимум 15 млрд кубометров американского СПГ. В ближайшие годы страны планируют добиться поставок не менее 50 млрд кубометров в год. Это позволит заменить 1/3 всех поставок российского газа в Европу, отметила фон дер Ляйен. Глава российского МИДа Сергей Лавров, говоря о «санкционном беспределе» Запада, заявил, что западные страны объявили России гибридную «тотальную» войну, чтобы ее разрушить."
10,https://www.rbc.ru/politics/29/03/2022/6243560b9a794711c1e075ee,"В районе села Красный Октябрь в Белгородской области произошли взрывы, жертв и пострадавших нет, разрушений на территории населенного пункта тоже, сообщил губернатор региона Вячеслав Гладков в своем Telegram-канале. «Сейчас на территории Белгорода и Белгородского района слышны взрывы. Инцидент произошел в районе села Красный Октябрь. Глава села сейчас находится на месте. Со мной на прямой связи. Оперативно мне сообщает всю информацию», — написал Гладков, добавив, что на месте сейчас работают экстренные службы. На данный момент взрывы прекратились, написал он позднее. По словам Гладкова, среди жителей села пострадавших нет. «На место прибыла оперативная группа МЧС. Сейчас будет проведен еще один обход села, чтобы осмотреть дома на наличие повреждений. О причине произошедшего сообщу после всех проведенных следственных мероприятий», — указал он. Село Красный Октябрь находится приблизительно в 12 км от российско-украинской границы. ТАСС со ссылкой на источник в экстренных службах сообщает, что при попадании снаряда в военный городок в Белгородской области были ранены четверо военнослужащих. «РИА Новости» со ссылкой на представителя экстренных служб рассказало о четырех раненых сотрудниках силовых структур при взрыве в области, не уточнив точное место происшествия. Гладков сообщил о превышенном лимите ЧП в Белгородской области Политика 23 марта в селе Журавлевка Белгородской области разорвался снаряд, выпущенный с украинской стороны. Губернатор сообщил о троих пострадавших мирных жителях. Для безопасности жителей в Журавлевке и на хуторе Нехотеевка ввели режим ЧС. Позже, в ночь на 24 марта, в селе произошло еще несколько взрывов, раненых и погибших не было, отмечал Гладков. О разрыве нескольких снарядов, залетевших на территорию области, губернатор сообщал 24 февраля. Тогда пострадали двое взрослых и ребенок 2015 года рождения. По факту произошедшего СК возбудил уголовное дело о покушении на убийство двух и более лиц. По словам Гладкова, в результате происшествия были повреждены семь домов. Проживавших там людей временно разместили в гостиницах и пообещали оказать помощь в восстановлении жилья, рассказал губернатор. Белгородская область граничит с Луганской народной республикой, а также с Харьковской и Сумской областями Украины."
