,url,text
0,https://www.rbc.ru/politics/25/03/2022/623dd1d99a7947780ae18ae6,"В комплексном договоре, на котором настаивает российская сторона на переговорах с Украиной, должны быть жизненно важные для России позиции — демилитаризация, денацификация, определение и признание Крыма и Донбасса. Без этих условий заключение договора маловероятно, заявил глава российской делегации, помощник президента Владимир Мединский, передает «РИА Новости». «Мы настаиваем на комплексном договоре, который помимо нейтрального статуса Украины, помимо гарантий безопасности Украины предусматривает еще целый ряд позиций, жизненно важных для нашей страны — демилитаризация, денацификация, определение и признание Крыма и Донбасса, а также целый ряд других договорных позиций, без рассмотрения и учета которых, я думаю, заключение договора маловероятно», — отметил он. Глава российской делегации подчеркнул, что по принципиальным для России позициям движения пока нет, поэтому он не разделяет оптимизма украинской стороны, которая заявляет о «большом продвижении вперед». Мединский указал, что Киев, в первую очередь, обеспокоен получением гарантий безопасности со стороны третьих стран в случае отказа от вступления в НАТО. Глава российской делегации считает эту позицию вполне объяснимой. В то же время, отмечает Мединский, Украина «ограничена в принятии собственных решений» и в ходе переговоров советуется с третьими сторонами. По его словам, украинская сторона стремится затянуть переговоры, полагая, что время работает на нее. «Они никуда не торопятся, полагают, что время работает на них, и откровенно говорят, что у них много центров принятия решений, с которыми нужно согласовать те или иные решения. Вот в таких реалиях мы находимся», — сказал Мединский. Мединский заявил, что делегации «топчутся на месте» по главным вопросам Политика Ранее Мединский сообщал, что позиции российской и украинской стороны по второстепенным вопросам сближаются, но по главным позициям они все еще «топчутся на месте». Он рассказал, что переговоры шли всю неделю и продолжатся завтра, 26 марта. Они идут по видеосвязи между экспертными группами, а два-три раза в неделю между собой общаются главы делегаций, в прошлый раз такой разговор состоялся накануне, 24 марта. С 24 февраля Россия проводит военную операцию по демилитаризации и «денацификации» Украины. С тех пор стороны провели несколько раундов переговоров в Белоруссии, затем обсуждение продолжилось в видеоформате. 18 марта Мединский заявил, что по вопросу демилитаризации Украины стороны находятся «где-то на полпути». Что касается денацификации, глава российской делегации назвал ситуацию странной, поскольку украинская сторона считает, что на Украине нет никаких нацистских образований. В то же время, по его словам, Москва и Киев «максимально сблизили свои позиции» по вопросам нейтрального статуса и отказа Украины от вступления в НАТО."
1,https://www.rbc.ru/politics/30/03/2022/624460919a79476dbb8b7d48,"Глава МИД Венгрии Петер Сийярто заявил, что несколько дней назад министр иностранных дел Украины Дмитрий Кулеба предложил украинскому послу в Будапеште «проконсультироваться о возможности влияния на результаты выборов в Венгрии», пишет портал Hirado. Парламентские выборы в стране пройдут 3 апреля. По словам Сийярто, Киев заинтересован в политическом усилении венгерских левых партий, так как надеется, что с их приходом к власти изменится позиция Будапешта насчет отправки оружия на Украину. «Президент Украины постоянно нападает на венгерское правительство за то, что мы приняли решение не поставлять оружие на Украину в целях обеспечения безопасности венгерского народа, а также не голосовать за санкции, которые ставят под угрозу безопасность нашего энергоснабжения», — заявил Сийярто. Венгрия запретила поставлять оружие на Украину со своей территории Политика Министр заявил, что Венгрия не должна быть втянута в украинский конфликт и подвергать своих граждан опасности. «Если бы венгерские левые вошли в правительство, они немедленно начали бы поставки оружия и они бы немедленно проголосовали за санкции в отношении нефти и природного газа», — пояснил глава МИДа. 27 февраля премьер-министр Венгрии Виктор Орбан заявил, что республика не будет поставлять оружие на Украину, так как ей необходимо все имеющееся вооружение для собственной защиты. Орбан также подтвердил позицию Будапешта, согласно которой Венгрия не должна вмешиваться в проведение операции на Украине. Также республика запретила транзитные поставки оружия на Украину через свою территорию. О поставках Украине оружия сообщили в том числе Дания, Швеция, Франция, Германия и Австралия. Киев критиковал Будапешт за принятые решения. «Что это такое? Хотите дешевого российского газа? Или, может, вы хотите наше Закарпатье?..» — отреагировала вице-премьер Украины Ирина Верещук. С критикой выступил и президент Украины Владимир Зеленский. Орбан на это ответил, что его страна отстаивает свои национальные интересы. Такое же мнение высказал и Сийярто: «Мы понимаем, что Украина и украинский народ превыше всего для президента Украины. А безопасность Венгрии и венгерского народа превыше всего для нас»."
2,https://www.rbc.ru/politics/31/03/2022/6245b24f9a7947e573b0d4ac,"Video В Минобороны России считают, что сын президента США Джо Байдена Хантер «сыграл важную роль» в финансировании работы с патогенами в биолабораториях на территории Украины, заявил начальник войск радиационной, химической и биологической защиты Вооруженных сил России Игорь Кириллов. Генерал-лейтенант показал презентацию, где были представлены фрагменты переписки, как утверждает Кириллов, Хантера Байдена, сотрудников Управления по снижению угрозы Минобороны США (DTRA) и подрядных организаций Пентагона на Украине. По требованию Роскомнадзора РБК приводит данные о деталях военной операции на Украине на основании информации российских официальных источников. «Содержание писем показывает, что Хантер Байден сыграл важную роль в создании финансовой возможности проведения работ с патогенами на территории Украины, обеспечив привлечение средств для компаний Black and Veatch и Metabiota, — заявил начальник войск РХБ. — Опубликованная переписка свидетельствует о том, что истинные цели Пентагона на Украине далеки от научных. Так, в одном из писем вице-президент Metabiota отмечает, что деятельность компании будет направлена на обеспечение «…культурной и экономической независимости Украины от России…», что довольно странно для биотехнологической компании». Кириллов также поименно перечислил тех, кого в российском Минобороны подозревают в причастности к работе биолабораторий на территории Украины и к изучению там опасных патогенов. Это бывший сотрудник DTRA Роберт Поуп, глава офиса DTRA на Украине Джоанна Уинтрол, глава украинского подразделения компании Black and Veatch Лэнс Липпенкотт и другие. В Минобороны связали фонд сына Байдена с биолабораториями на Украине Политика О причастности инвестиционного фонда Rosemont Seneca Technology Partners к финансированию работы биолабораторий на Украине Минобороны сообщило 24 марта. По данным ведомства, этим фондом руководит Хантер Байден. В 2020 году адвокат Байдена-младшего утверждал, что тот не является и не являлся совладельцем компании. Заявления о том, что в биолабораториях на Украине разрабатывалось биологическое оружие, Минобороны делает с начала марта. По его данным, эту программу финансировал в том числе Пентагон. Американские ведомства, в том числе Госдепартамент и Пентагон, отвергли обвинения в содействии разработке биологического оружия. Президент Украины Владимир Зеленский в ответ на публикации Минобороны заявил, что он — «президент адекватной страны» и что оружия массового поражения на Украине не разрабатывали."
3,https://www.rbc.ru/politics/30/03/2022/62444a769a79475f8b37f3b0,"Россия совместно с Ираном и Китаем намерена искать способы обхода санкций. Об этом заявил глава российского МИДа Сергей Лавров во время встречи в Китае с иранским министром иностранных дел Хоссейном Абдоллахианом. Лавров принимает участие в третьей конференции глав МИД стран — соседей Афганистана в китайском городе Туньси. Глава МИД Китая назвал неприемлемыми санкции против России Политика «Одним из инструментов такой неприемлемой политики является механизм односторонних нелегитимных санкций. В наших отношениях с Ираном, с другими близкими партнерами будем добиваться осуждения этого неприемлемого явления в международных дискуссиях. Также будем выстраивать практические шаги, которые позволят обходить эти незаконные действия», — сказал Лавров. Российский министр вновь обвинил Запад в попытке с помощью санкций «подорвать принцип суверенного равенства государств и невмешательства во внутренние дела других стран». «Заинтересованы в наращивании партнерства с Ираном, нашими друзьями и соседями по всем направлениям: в двусторонних делах, на Каспии и в других региональных вопросах. В более широком плане наши взаимодействия имеют важнейшие значения для того, чтобы вести разговор на универсальном уровне по отстаиванию ключевых вопросов, касающихся дальнейшего мироустройства», — сказал Лавров. На состоявшейся там же встрече с главой МИД Пакистана Мехмудом Куреши Лавров заявил о попытках Запада сделать из Украины центр мировой политики. «Те, кто раньше пытался сделать Афганистан центром мировой политики, теперь старается заставить Украину «заменить» Афганистан. Мы все понимаем, как на самом деле обстоит дело», — сказал Лавров. Как сообщило после встречи российское внешнеполитическое ведомство, министры подтвердили необходимость дальнейшей координации действий, в первую очередь в рамках расширенной «тройки» — Россия, США, Китай и Пакистан — по обеспечению стабильности и безопасности в Афганистане. «В качестве приоритетных задач определены увеличение товарооборота и реализация ряда проектов в энергетической сфере, включая строительство газопровода «Пакистанский поток», — говорится в сообщении МИДа. Зампостпреда при ООН назвала причиной продовольственного кризиса санкции Политика В конце февраля и марте США, ЕС, Великобритания и ряд других стран начали ужесточать санкции против России. Почти за месяц были введены несколько пакетов ограничений, которые затронули значительную часть российских компаний, в частности, связанных с оборонным и энергетическим секторами, банки, транспортные компании, парламентариев, чиновников, бизнесменом и журналистов, а также членов семей подпавших под санкции лиц. В конце февраля Евросоюз и США решили заблокировать активы Банка России, заморозив его транзакции с целью ограничить «использование собственных международных резервов для ослабления воздействия западных санкций». Глава Минфина Антон Силуанов отмечал, что Россия из-за ограничений лишилась доступа почти к половине своих золотовалютных резервов — $300 млрд. Россия в ответ на заморозку резервов в долларах и евро ограничила движение средств, которые могли быть перечислены в недружественные страны, на сопоставимую сумму. Иностранным инвесторам запретили продажу ценных бумаг и вывод средств из российской финансовой системы. США в начале марта предупреждали о последствиях для тех стран и компаний, которые попытаются обойти санкции против России. В частности, Вашингтон адресовал такое предупреждение китайскому бизнесу. Как заявила министр торговли США Джина Раймондо, китайские компании, которые игнорируют ограничения США на экспорт в Россию, могут лишиться американского оборудования и программного обеспечения, необходимого им для производства своей продукции. ЕС расширил санкции в отношении России за счет «правила 50%» Экономика Помешать России обойти санкции с помощью криптовалют обещал Евросоюз. Сообщая об этом, министр экономики, финансов и восстановления Франции Брюно Ле Мэр не раскрыл конкретных шагов в этой сфере. Экс-президент России, бывший премьер-министр, а ныне заместитель председателя Совета безопасности Дмитрий Медведев заявил 30 марта, что санкции против России вернутся западным странам бумерангом, не достигнув результатов. По словам Медведева, из-за санкций против России глобальная инфляция увеличивается и в Европе, возможно, начинается рецессия. Бывший премьер считает, что не все государства успешно справятся с таким спадом, а запрет на экспорт российских энергоресурсов ударил по обычным гражданам западных стран, владеющим автомобилями и живущим в домах с газовым отоплением."
